{
  "schema": "z_shared_roots_registry_v1",
  "phase": "Z-SRM-OBSERVE-1",
  "law": "Similarity is observation. Sharing requires evidence. Canonicalisation requires authority. Z-SRM consumes Atlas/SEIF/Crystal/ZSX; it is not a second Atlas.",
  "observations": [
    {
      "capability_id": "srm.legal-evidence-doctrine",
      "display_name": "Legal / evidence doctrine",
      "classification": "KEEP_LOCAL",
      "origin": "hypothesis: legal/evidence stack as multi-project shared root",
      "observed_consumers": [
        { "id": "root.z-sanctuary-universe", "evidence": "hub legal ops registry and workstation live in this repo" }
      ],
      "evidence": [
        { "path": "docs/Z_LEGAL_EVIDENCE_CORE.md", "note": "hub proof-first legal evidence concept" },
        { "path": "data/z_legal_ops_registry.json", "note": "legal ops concept registry" },
        { "path": "data/z_legal_workstation_stack_registry.json", "note": "workstation stack registry" }
      ],
      "lineage": "Z-LEGAL-OPS-1 and later workstation slices on hub main",
      "dependencies": ["docs/Z_LEGAL_EVIDENCE_CORE.md"],
      "divergence": "Isolated-base evidence is hub-local. No sibling-project legal stack is proven from hub files alone. Similar names elsewhere would be DUPLICATE_NAME, not SHARED_DOCTRINE.",
      "confidence_basis": "HIGH_EVIDENCE_ALIGNMENT",
      "status": "OBSERVED",
      "human_review": false
    },
    {
      "capability_id": "srm.signal-vocabulary",
      "display_name": "Hub observer signal vocabulary",
      "classification": "SHARED_DOCTRINE",
      "origin": "hypothesis: RED/BLUE/YELLOW/GREEN (and kin) as shared observer language",
      "observed_consumers": [
        { "id": "scripts/z_crystal_dna_drift_check.mjs", "evidence": "Crystal DNA drift signals" },
        { "id": "scripts/z_cycle_observe_status.mjs", "evidence": "Cycle Observe rollup" },
        { "id": "scripts/z_traffic_minibots_status.mjs", "evidence": "Traffic tower" }
      ],
      "evidence": [
        { "path": "docs/Z_CYCLE_OBSERVE_SYSTEM.md", "note": "observer signal doctrine" },
        { "path": "scripts/z_crystal_dna_drift_check.mjs", "note": "SIGNAL_ORDER includes BLUE/HOLD" },
        { "path": "docs/Z_TRAFFIC_MINIBOTS.md", "note": "traffic GREEN/hold language" }
      ],
      "lineage": "hub observer family; not a runtime service",
      "dependencies": [],
      "divergence": "Vocabulary is SHARED_DOCTRINE inside the hub. Sibling-repo adoption is not measured (PC-wide scan forbidden). SHARED_DOCTRINE ≠ shared implementation.",
      "confidence_basis": "PARTIAL_EVIDENCE",
      "status": "OBSERVED",
      "human_review": true
    },
    {
      "capability_id": "srm.topology-awareness",
      "display_name": "Organism topology awareness (Atlas)",
      "classification": "KEEP_LOCAL",
      "origin": "hypothesis: topology awareness as a shared capability to extract",
      "observed_consumers": [
        { "id": "gate.atlas-0-5", "evidence": "Atlas Phase 0.5 registry is the topology map" }
      ],
      "evidence": [
        { "path": "docs/z_atlas/Z_ATLAS_CONSTITUTION.md", "note": "Atlas maps what exists" },
        { "path": "data/z_atlas/z_atlas_registry_v0_5.json", "note": "machine-readable topology; not machine-authoritative" }
      ],
      "lineage": "Z-ATLAS-0 / 0.5 on origin/main",
      "dependencies": ["data/z_atlas/z_atlas_registry_v0_5.json"],
      "divergence": "Atlas already occupies topology. Extracting a second topology brain would be duplication. SRM consumes Atlas; it does not redefine nodes or edges.",
      "confidence_basis": "HIGH_EVIDENCE_ALIGNMENT",
      "status": "OBSERVED",
      "human_review": false
    },
    {
      "capability_id": "srm.seif-capability-inventory",
      "display_name": "SEIF anti-duplication / capability awareness",
      "classification": "KEEP_LOCAL",
      "origin": "hypothesis: capability inventory as an SRM field",
      "observed_consumers": [
        { "id": "docs/z_seif/Z_SEIF_CONSTITUTION.md", "evidence": "SEIF constitution on base" }
      ],
      "evidence": [
        { "path": "docs/z_seif/Z_SEIF_CONSTITUTION.md", "note": "projects remain sovereign; Atlas knows where they are" },
        { "path": "docs/z_seif/Z_SEIF_PLATFORM_CAPABILITY_ATLAS.md", "note": "platform capability atlas" },
        { "path": "docs/z_seif/Z_SEIF_EXISTING_CAPABILITY_RECONCILIATION.md", "note": "before BUILD, prove GAP" }
      ],
      "lineage": "Z-SEIF-0 architecture only",
      "dependencies": ["docs/z_seif/Z_SEIF_CONSTITUTION.md"],
      "divergence": "SEIF already answers capability-awareness. SRM must not create a parallel ontology. Note: SEIF cites PID contract and z_universe_project_registry.json as EXISTING; those paths are absent on this isolated base (CONFLICTING_EVIDENCE vs SEIF text — reported, not repaired).",
      "confidence_basis": "PARTIAL_EVIDENCE",
      "status": "OBSERVED",
      "human_review": true
    },
    {
      "capability_id": "srm.drift-observation",
      "display_name": "Structural / path drift observation",
      "classification": "KEEP_LOCAL",
      "origin": "hypothesis: drift observation as shared multi-project root",
      "observed_consumers": [
        { "id": "scripts/z_crystal_dna_drift_check.mjs", "evidence": "Crystal DNA drift observer" }
      ],
      "evidence": [
        { "path": "data/z_crystal_dna_asset_manifest.json", "note": "Crystal DNA asset manifest" },
        { "path": "scripts/z_crystal_dna_drift_check.mjs", "note": "writes only drift reports" }
      ],
      "lineage": "Z-CRYSTAL-DNA drift observer",
      "dependencies": ["data/z_crystal_dna_asset_manifest.json"],
      "divergence": "Hub-scoped observer. Not evidence that sibling projects share Crystal DNA runtime.",
      "confidence_basis": "HIGH_EVIDENCE_ALIGNMENT",
      "status": "OBSERVED",
      "human_review": false
    },
    {
      "capability_id": "srm.duplicate-path-observation",
      "display_name": "Duplicate / path / similarity observation",
      "classification": "SHARED_CAPABILITY_CANDIDATE",
      "origin": "hypothesis: duplicate-path observation as a shared organ",
      "observed_consumers": [
        { "id": "scripts/z_car2_scan.mjs", "evidence": "CAR2 similarity scan" },
        { "id": "docs/root-discovery-audit/DUPLICATES_AND_OVERLAPS.md", "evidence": "root discovery duplicate audit" }
      ],
      "evidence": [
        { "path": "docs/root-discovery-audit/DUPLICATES_AND_OVERLAPS.md", "note": "DUPLICATE_NAME / path collisions; not byte-identity" },
        { "path": "scripts/z_car2_scan.mjs", "note": "similarity scan — SEMANTIC_SIMILARITY / SIMILAR_STRUCTURE, not extraction" }
      ],
      "lineage": "root-discovery-audit + CAR2",
      "dependencies": [],
      "divergence": "Duplicate audit ≠ shared implementation. DUPLICATE_NAME and SIMILAR_STRUCTURE remain distinct from SHARED_CAPABILITY_CANDIDATE until human review.",
      "confidence_basis": "PARTIAL_EVIDENCE",
      "status": "OBSERVED",
      "human_review": true
    },
    {
      "capability_id": "srm.minibot-observer-responsibilities",
      "display_name": "MiniBot / observer responsibilities",
      "classification": "KEEP_LOCAL",
      "origin": "hypothesis: eight new MiniBot engines for SRM roles",
      "observed_consumers": [
        { "id": "scripts/z_traffic_minibots_status.mjs", "evidence": "traffic tower minibots" }
      ],
      "evidence": [
        { "path": "docs/Z_TRAFFIC_MINIBOTS.md", "note": "read-only traffic tower; does not auto-fix" },
        { "path": "scripts/z_traffic_minibots_status.mjs", "note": "existing minibot runner" }
      ],
      "lineage": "ZTR-1 traffic minibots",
      "dependencies": ["docs/Z_TRAFFIC_MINIBOTS.md"],
      "divergence": "Logical SRM roles map onto existing observers. Creating eight new engines would duplicate Traffic / Cycle Observe / Crystal DNA / Fusion Map.",
      "confidence_basis": "HIGH_EVIDENCE_ALIGNMENT",
      "status": "OBSERVED",
      "human_review": false
    },
    {
      "capability_id": "srm.graph-display-capability",
      "display_name": "Graph / related-evidence display",
      "classification": "SHARED_CAPABILITY_CANDIDATE",
      "origin": "hypothesis: evidence-graph display as a future shared organ (not CaseGraph this slice)",
      "observed_consumers": [
        { "id": "docs/LAWGRID_1A_GOVERNANCE_OBSERVATORY.md", "evidence": "governance observatory" },
        { "id": "docs/dashboard/Z_UNIVERSE_WORKSTATION_NAVIGATOR.md", "evidence": "NAV-1 read-only cockpit" }
      ],
      "evidence": [
        { "path": "docs/LAWGRID_1A_GOVERNANCE_OBSERVATORY.md", "note": "read-only governance observatory" },
        { "path": "docs/dashboard/Z_UNIVERSE_WORKSTATION_NAVIGATOR.md", "note": "NAV-1 visibility only; no execution" }
      ],
      "lineage": "existing read-only surfaces; CaseGraph CLOSED this phase",
      "dependencies": [],
      "divergence": "Multiple display surfaces exist. That is SIMILAR_STRUCTURE / DUPLICATE_NAME risk, not proof of a shared evidence-graph organ. CaseGraph is not authorized here and is not declared the solution.",
      "confidence_basis": "INSUFFICIENT_EVIDENCE",
      "status": "HUMAN_REVIEW_REQUIRED",
      "human_review": true
    },
    {
      "capability_id": "srm.project-identity-consumption",
      "display_name": "Project identity consumption",
      "classification": "HUMAN_REVIEW_REQUIRED",
      "origin": "hypothesis: one identity contract consumed by all project organisms",
      "observed_consumers": [
        { "id": "eirmind-ireland-projects-missing", "evidence": "pc_root row with empty path" },
        { "id": "sister-aisling-sol", "evidence": "pc_root member path Z-Sister Aisling Sol" },
        { "id": "pointer.missing.eirmind-ireland-projects", "evidence": "Atlas missing pointer" },
        { "id": "root.z-sister-aisling-sol", "evidence": "Atlas root node" }
      ],
      "evidence": [